id,authors,original_title,title,language_code
2461,Terry Goodkind,"Confessor (Sword of Truth, #11)","Confessor (Sword of Truth, #11)",en-US
2462,Mohsin Hamid,The Reluctant Fundamentalist,The Reluctant Fundamentalist,eng
2463,Jennifer A. Nielsen,The False Prince,The False Prince (The Ascendance Trilogy #1),eng
2464,John Updike,"Rabbit, Run","Rabbit, Run (Rabbit Angstrom #1)",eng
2465,Daniel Todd Gilbert,Stumbling on Happiness,Stumbling on Happiness,eng
2466,T.S. Eliot,The Waste Land and Other Poems,The Waste Land and Other Poems,en-US
2467,"Else Holmelund Minarik, Maurice Sendak",Little Bear,Little Bear,eng
2468,Edgar Allan Poe,The Pit and the Pendulum,The Pit and the Pendulum,eng
2469,Terry Pratchett,Lords and Ladies,"Lords and Ladies (Discworld, #14; Witches #4)",eng
2470,Terry Pratchett,Thud!,"Thud! (Discworld, #34; City Watch #7)",eng
2471,Naomi Novik,His Majesty's Dragon,"His Majesty's Dragon (Temeraire, #1)",eng
2472,"Holly Black, Tony DiTerlizzi",The Field Guide,"The Field Guide (The Spiderwick Chronicles, #1)",eng
2473,David Platt,,Radical: Taking Back Your Faith from the American Dream,eng
2474,"Robert Greene, Joost Elffers",The 48 Laws of Power,The 48 Laws of Power,
2475,Jean Craighead George,My Side of the Mountain ,"My Side of the Mountain (Mountain, #1)",eng
2476,"Susanna Kearsley, Rosalyn Landor",The Winter Sea,"The Winter Sea (Slains, #1)",eng
2477,Peter Lerangis,The Sword Thief,"The Sword Thief (The 39 Clues, #3)",eng
2478,Robin Cook,Coma,Coma,eng
2479,"Hubert Selby Jr., Darren Aronofsky, Richard Price",Requiem for a Dream,Requiem for a Dream,eng
2480,Erin Hunter,Into the Wild,"Into the Wild (Warriors, #1)",eng
2481,Dee Brown,Bury My Heart at Wounded Knee: An Indian History of the American West,Bury My Heart at Wounded Knee: An Indian History of the American West,
2482,"Władysław Szpilman, Anthea Bell",Śmierć Miasta ,"The Pianist: The Extraordinary Story of One Man's Survival in Warsaw, 1939–45",
2483,Maya Banks,Rush,"Rush (Breathless, #1)",eng
2484,"Ian Edginton, Oscar Wilde, I.N.J. Culbard",The Picture of Dorian Gray: A Graphic Novel ,The Picture of Dorian Gray: A Graphic Novel,eng
2485,Robert McCammon,Swan Song,Swan Song,eng
2486,Kazuo Ishiguro,The Buried Giant,The Buried Giant,eng
2487,China Miéville,Perdido Street Station,"Perdido Street Station (Bas-Lag, #1)",eng
2488,Carrie Jones,Need,"Need (Need, #1)",eng
2489,Terry Pratchett,Witches Abroad,"Witches Abroad (Discworld, #12; Witches #3)",eng
2490,"Geoffrey Crayon, Washington Irving, William L. Hedges","The Sketch Book of Geoffrey Crayon, Gent",The Legend of Sleepy Hollow and Other Stories,eng
2491,Frank Herbert,Heretics of Dune,Heretics of Dune (Dune Chronicles #5),eng
2492,"David Wilkerson, John Sherrill, Elizabeth Sherrill",The Cross and the Switchblade,The Cross and the Switchblade,
2493,Jim Butcher,Captain's Fury,"Captain's Fury (Codex Alera, #4)",eng
2494,Chuck Palahniuk,Damned,"Damned (Damned, #1)",eng
2495,Cynthia Lord,Rules,Rules,
2496,Karen Russell,Swamplandia!,Swamplandia!,eng
2497,Michael Connelly,The Last Coyote,"The Last Coyote (Harry Bosch, #4; Harry Bosch Universe, #4)",eng
2498,Mark Kurlansky,Salt: A World History,Salt: A World History,eng
2499,"Charlotte Brontë, A.S. Byatt, Μαρία Λαϊνά, Ignes Sodre",Villette,Villette,eng
2500,Neal Stephenson,Reamde,Reamde,eng
2501,Terry Pratchett,Soul Music,"Soul Music (Discworld, #16; Death, #3)",eng
2502,Janet Evanovich,Notorious Nineteen,"Notorious Nineteen (Stephanie Plum, #19)",eng
2503,Richard Dawkins,The Greatest Show on Earth: The Evidence for Evolution,The Greatest Show on Earth: The Evidence for Evolution,en-GB
2504,Frank Miller,Sin City Volume 1: The Hard Goodbye,"Sin City, Vol. 1: The Hard Goodbye (Sin City, #1)",eng
2505,Og Mandino,The Greatest Salesman in the World,The Greatest Salesman in the World,eng
2506,Ian Fleming,Casino Royale,"Casino Royale (James Bond, #1)",eng
2507,Paullina Simons,The Bronze Horseman,"The Bronze Horseman (The Bronze Horseman, #1)",eng
2508,Toni Morrison,Sula,Sula,en-US
2509,A.G. Riddle,The Atlantis Gene,"The Atlantis Gene (The Origin Mystery, #1)",eng
2510,Philippa Gregory,The Red Queen,"The Red Queen (The Plantagenet and Tudor Novels, #3)",eng
2511,Julie James,Something About You,"Something About You (FBI/US Attorney, #1)",eng
2512,Dr. Seuss,Mr. Brown Can Moo! Can You?,Mr. Brown Can Moo! Can You?,en-US
2513,"Stephen King, Peter Straub",Black House ,"Black House (The Talisman, #2)",eng
2514,"Neil Gaiman, Andy Kubert, Richard Isanove, Peter Sanderson",Marvel 1602,Marvel 1602,eng
2515,Vince Flynn,Act of Treason,"Act of Treason (Mitch Rapp, #9)",en-US
2516,Peter Heller,The Dog Stars,The Dog Stars,
2517,John le Carré,The Spy Who Came In from the Cold,The Spy Who Came In from the Cold,eng
2518,Jim Butcher,Academ's Fury,"Academ's Fury (Codex Alera, #2)",eng
2519,James Patterson,When the Wind Blows,"When the Wind Blows (When the Wind Blows, #1)",eng
2520,"Haruki Murakami, 村上 春樹",1Q84 Book 1 [Ichi-kyū-hachi-yon],"1Q84 BOOK 1 (1Q84, #1)",jpn
2521,"Paulo Coelho, Alan R. Clarke",O Diário de um Mago,The Pilgrimage,eng
2522,Lee Child,The Hard Way,"The Hard Way (Jack Reacher, #10)",en-US
2523,Sheila Burnford,The Incredible Journey,The Incredible Journey,eng
2524,Geraldine Brooks,March,March,en-US
2525,"Lee Child, Dick Hill",A Wanted Man,"A Wanted Man (Jack Reacher, #17)",eng
2526,"Grant Morrison, Frank Quitely",All-Star Superman (Volume 1),"All-Star Superman, Vol. 1",eng
2527,George R.R. Martin,A Song of Ice and Fire,"A Song of Ice and Fire (A Song of Ice and Fire, #1-5)",eng
2528,Nora Roberts,Dark Witch,"Dark Witch (The Cousins O'Dwyer Trilogy, #1)",eng
2529,Alyson Noel,Dark Flame,"Dark Flame (The Immortals, #4)",eng
2530,Fiona Barton,The Widow,The Widow,eng
2531,Patrick Carman,The Black Circle,"The Black Circle (The 39 Clues, #5)",en-US
2532,Kiera Cass,The Prince,"The Prince (The Selection, #0.5)",
2533,Marie Rutkoski,The Winner's Curse,"The Winner's Curse (The Winner's Trilogy, #1)",eng
2534,Sapphire,Push,Push,eng
2535,"Elena Ferrante, Ann Goldstein",Storia del nuovo cognome,The Story of a New Name (The Neapolitan Novels #2),eng
2536,Arthur C. Clarke,2010: Odyssey Two,"2010: Odyssey Two (Space Odyssey, #2)",eng
2537,Atsushi Ohkubo,ソウルイーター 1,"Soul Eater, Vol. 01 (Soul Eater, #1)",en-US
2538,William Kent Krueger,Ordinary Grace,Ordinary Grace,eng
2539,David Baldacci,Last Man Standing,Last Man Standing,eng
2540,Gene Luen Yang,American Born Chinese,American Born Chinese,eng
2541,"Eugene Bradley Coco, Ron Dias, Walt Disney Company",Peter Pan (Little Golden Book),Peter Pan (A Little Golden Book),eng
2542,K.A. Tucker,Ten Tiny Breaths,"Ten Tiny Breaths (Ten Tiny Breaths, #1)",eng
2543,David Mitchell,The Thousand Autumns of Jacob de Zoet,The Thousand Autumns of Jacob de Zoet,eng
2544,Christopher Marlowe,The Tragical History of the Life and Death of Doctor Faustus,Dr. Faustus,eng
2545,Sherrilyn Kenyon,Dance with the Devil,Dance with the Devil (Dark-Hunter #3),eng
2546,Candace Bushnell,Lipstick Jungle,Lipstick Jungle,eng
2547,James Patterson,Violets Are Blue,"Violets Are Blue (Alex Cross, #7)",eng
2548,"Anthony Robbins, Tony Robbins, Frederick L. Covan","Awaken the Giant Within: How to Take Immediate Control of Your Mental, Emotional, Physical and Financial Destiny!","Awaken the Giant Within: How to Take Immediate Control of Your Mental, Emotional, Physical and Financial Destiny!",eng
2549,Laurell K. Hamilton,"Blue Moon (Anita Blake, Vampire Hunter, #8)","Blue Moon (Anita Blake, Vampire Hunter, #8)",en-US
2550,Laurell K. Hamilton,"Burnt Offerings (Anita Blake, Vampire Hunter, #7)","Burnt Offerings (Anita Blake, Vampire Hunter, #7)",en-US
2551,Diane Chamberlain,The Silent Sister,"The Silent Sister (Riley MacPherson, #1)",eng
2552,Kurt Vonnegut Jr.,Player Piano,Player Piano,eng
2553,Arthur Conan Doyle,The Lost World ,"The Lost World (Professor Challenger, #1)",
2554,Terry Pratchett,Monstrous Regiment,"Monstrous Regiment (Discworld, #31; Industrial Revolution, #3)",eng
2555,Octavia E. Butler,Kindred,Kindred,eng
2556,"Laura Ingalls Wilder, Garth Williams","The Long Winter (Little House, #6)","The Long Winter (Little House, #6)",
2557,"Henry Cloud, John Townsend",Boundaries,"Boundaries: When to Say Yes, How to Say No to Take Control of Your Life",en-US
2558,Maggie Stiefvater,"Blue Lily, Lily Blue","Blue Lily, Lily Blue (The Raven Cycle, #3)",eng
2559,"Philip Roth, Luca Marinelli",Portnoy's Complaint,Portnoy's Complaint,
2560,"John C. Maxwell, Zig Ziglar",The 21 Irrefutable Laws of Leadership,The 21 Irrefutable Laws of Leadership: Follow Them and People Will Follow You,eng
2561,Margaret Atwood,Cat's Eye,Cat's Eye,eng
2562,J. Sterling,The Perfect Game,"The Perfect Game (The Perfect Game, #1)",eng
2563,Patrick Ness,Monsters of Men,"Monsters of Men (Chaos Walking, #3)",eng
2564,Orson Scott Card,Shadow of the Giant,"Shadow of the Giant (Ender's Shadow, #4)",eng
2565,Brian Selznick,Wonderstruck,Wonderstruck,eng
2566,Sarah Ban Breathnach,Simple Abundance:  A Daybook of Comfort and Joy,Simple Abundance:  A Daybook of Comfort and Joy,en-US
2567,Moira Young,Blood Red Road ,"Blood Red Road (Dust Lands, #1)",eng
2568,"James Patterson, Maxine Paetro",The 6th Target,"The 6th Target (Women's Murder Club, #6)",en-US
2569,"Edgar Rice Burroughs, John Seelye",A Princess of Mars,"A Princess of Mars (Barsoom, #1)",en-GB
2570,Margaret Atwood,MaddAddam,"MaddAddam (MaddAddam, #3)",eng
2571,"Laura Ingalls Wilder, Garth Williams",These Happy Golden Years,"These Happy Golden Years (Little House, #8)",eng
2572,Victoria Finlay,Color: A Natural History of the Palette,Color: A Natural History of the Palette,en-US
2573,John Grisham,Skipping Christmas,Skipping Christmas,eng
2574,Michael Connelly,,"The Black Ice (Harry Bosch, #2; Harry Bosch Universe, #2)",eng
2575,Kristin Hannah,Home Front,Home Front,eng
2576,Christina Lauren,Beautiful Stranger,"Beautiful Stranger (Beautiful Bastard, #2)",eng
2577,Libba Bray,The Sweet Far Thing,"The Sweet Far Thing (Gemma Doyle, #3)",eng
2578,Ernest J. Gaines,A Lesson Before Dying,A Lesson Before Dying,en-US
2579,David Sedaris,SantaLand Diaries,SantaLand Diaries,en-US
2580,Nicholas Sparks,See Me,See Me,eng
2581,Sophie Kinsella,Mini Shopaholic,"Mini Shopaholic (Shopaholic, #6)",eng
2582,"Gene Zion, Margaret Bloy Graham",,Harry the Dirty Dog,en-US
2583,Jennifer Weiner,,All Fall Down,eng
2584,George Orwell,Down and Out in Paris and London,Down and Out in Paris and London,en-US
2585,Hiro Fujiwara,会長はメイド様! 1,"Maid-sama! Vol. 01 (Maid-sama!, #1)",eng
2586,Nick Bantock,Griffin & Sabine: An Extraordinary Correspondence,Griffin and Sabine (Griffin & Sabine #1),eng
2587,Leigh Bardugo,Ruin and Rising,"Ruin and Rising (Shadow and Bone, #3)",eng
2588,أحمد خالد توفيق,يوتوبيا,يوتوبيا,ara
2589,Jennifer Weiner,Certain Girls,Certain Girls (Cannie Shapiro #2),eng
2590,Cheryl Strayed,Tiny Beautiful Things: Advice on Love and Life from Dear Sugar,Tiny Beautiful Things: Advice on Love and Life from Dear Sugar,
2591,Karen Marie Moning,Beyond the Highland Mist,"Beyond the Highland Mist (Highlander, #1)",eng
2592,Ann Rule,The Stranger Beside Me,The Stranger Beside Me: Ted Bundy The Shocking Inside Story,en-GB
2593,Claudia Gray,Stargazer,"Stargazer (Evernight, #2)",eng
2594,Michael Crichton,Rising Sun,Rising Sun,eng
2595,Sidney Sheldon,The Other Side of Midnight,The Other Side of Midnight (Midnight #1),eng
2596,Michael Connelly,The Reversal,"The Reversal (Harry Bosch, #16; Mickey Haller, #4; Harry Bosch Universe, #19)",eng
2597,"Louis Sachar, Joel Schick",Wayside School is Falling Down,Wayside School Is Falling Down (Wayside School #2),eng
2598,"Julie Orringer, Arthur Morey",The Invisible Bridge,The Invisible Bridge,eng
2599,Pittacus Lore,The Fall of Five,"The Fall of Five (Lorien Legacies, #4)",eng
2600,"Thomas Hardy, Keith Wilson",The Mayor of Casterbridge,The Mayor of Casterbridge,eng
2601,John Steinbeck,The Red Pony,The Red Pony,
2602,Jo Nesbø,Marekors ,"The Devil's Star (Harry Hole, #5)",eng
2603,Alice Hoffman,Here on Earth ,Here on Earth,eng
2604,"Anne Rice, Tim Curry",Taltos,"Taltos (Lives of the Mayfair Witches, #3)",
2605,Laurell K. Hamilton,"Obsidian Butterfly (Anita Blake, Vampire Hunter, #9)","Obsidian Butterfly (Anita Blake, Vampire Hunter, #9)",eng
2606,Peter V. Brett,The Daylight War,"The Daylight War (Demon Cycle, #3)",eng
2607,John Grisham,The Appeal,The Appeal,en-US
2608,Tamora Pierce,The Woman Who Rides Like a Man,"The Woman Who Rides Like a Man (Song of the Lioness, #3)",en-US
2609,Ben Aaronovitch,Rivers of London,"Midnight Riot (Peter Grant, #1)",eng
2610,Marian Keyes,Lucy Sullivan is Getting Married,Lucy Sullivan Is Getting Married,en-US
2611,Terry Pratchett,A Hat Full of Sky,"A Hat Full of Sky (Discworld, #32; Tiffany Aching, #2)",eng
2612,Vikram Seth,A Suitable Boy,"A Suitable Boy (A Suitable Boy, #1)",en-US
2613,Chimamanda Ngozi Adichie,We Should All Be Feminists,We Should All Be Feminists,eng
2614,Patricia Briggs,River Marked,"River Marked (Mercy Thompson, #6)",en-GB
2615,Amy Sedaris,I Like You: Hospitality Under the Influence,I Like You: Hospitality Under the Influence,eng
2616,William Gibson,Pattern Recognition,"Pattern Recognition (Blue Ant, #1)",eng
2617,Peter  Swanson,The Kind Worth Killing,The Kind Worth Killing,eng
2618,Patricia Schultz,"1,000 Places to See Before You Die","1,000 Places to See Before You Die",
2619,"Angie Sage, Mark Zug",Physik,"Physik (Septimus Heap, #3)",en-US
2620,"Roald Dahl, Quentin Blake",Boy: Tales of Childhood,Boy: Tales of Childhood,eng
2621,Anne Lamott,Traveling Mercies: Some Thoughts on Faith,Traveling Mercies: Some Thoughts on Faith,en-CA
2622,Vince Flynn,Memorial Day,"Memorial Day (Mitch Rapp, #7)",eng
2623,Tamora Pierce,"Wild Magic (Immortals, #1)","Wild Magic (Immortals, #1)",en-US
2624,Isaac Asimov,Prelude to Foundation,Prelude to Foundation,eng
2625,Max Lucado,You Are Special: A Story for Everyone,"You Are Special (Wemmicksville, #1)",eng
2626,Renee Ahdieh,The Wrath & the Dawn,"The Wrath and the Dawn (The Wrath and the Dawn, #1)",eng
2627,"Nicholas D. Kristof, Sheryl WuDunn",Half the Sky: Turning Oppression into Opportunity for Women Worldwide,Half the Sky: Turning Oppression into Opportunity for Women Worldwide,eng
2628,"Daniel Handler, Maira Kalman",Why We Broke Up,Why We Broke Up,eng
2629,Sarah J. Maas,The Assassin's Blade,"The Assassin's Blade (Throne of Glass, #0.1-0.5)",eng
2630,Curtis Sittenfeld,American Wife,American Wife,eng
2631,Jim Butcher,Cursor's Fury,"Cursor's Fury (Codex Alera, #3)",eng
2632,Mary Doria Russell,The Sparrow,"The Sparrow (The Sparrow, #1)",eng
2633,Jodi Picoult,Mercy,Mercy,en-GB
2634,Charlie N. Holmberg,The Paper Magician,"The Paper Magician (The Paper Magician Trilogy, #1)",eng
2635,Steve Harvey,"Act Like a Lady, Think Like a Man","Act Like a Lady, Think Like a Man: What Men Really Think About Love, Relationships, Intimacy, and Commitment",
2636,Candice Millard,,"Destiny of the Republic: A Tale of Madness, Medicine and the Murder of a President",en-US
2637,"Shirley Jackson, Jonathan Lethem",We Have Always Lived in the Castle,We Have Always Lived in the Castle,eng
2638,Emerson Eggerichs,,Love and Respect: The Love She Most Desires; The Respect He Desperately Needs,
2639,Michael Connelly,The Brass Verdict,"The Brass Verdict (Harry Bosch, #14; Mickey Haller, #2; Harry Bosch Universe, #17)",eng
2640,Timothy Zahn,Star Wars: Dark Force Rising,Dark Force Rising,en-US
2641,Lee Child,Never Go Back ,"Never Go Back (Jack Reacher, #18)",eng
2642,Gail Carson Levine,The Two Princesses of Bamarre,The Two Princesses of Bamarre,eng
2643,"Richard Wright, Jerry W. Ward Jr.",Black Boy: A Record of Youth and Childhood,Black Boy,en-US
2644,Lalita Tademy,Cane River,Cane River,en-US
2645,Terry Goodkind,"Phantom (Sword of Truth, #10)","Phantom (Sword of Truth, #10)",
2646,Isaac Asimov,Foundation and Earth,Foundation and Earth (Foundation #5),eng
2647,"James D. Bradley, Ron Powers",Flags of Our Fathers,Flags of Our Fathers,
2648,"A.A. Milne, Ernest H. Shepard",Winnie-the-Pooh & The House at Pooh Corner,"The World of Winnie-the-Pooh (Winnie-the-Pooh, #1-2)",eng
2649,Mahatma Gandhi,An Autobiography or The Story of My Experiments with Truth,The Story of My Experiments With Truth,eng
2650,"Lance Armstrong, Sally Jenkins",It's Not About the Bike: My Journey Back to Life,It's Not About the Bike: My Journey Back to Life,en-US
2651,Stephen E. Ambrose,Undaunted Courage,Undaunted Courage: The Pioneering First Mission to Explore America's Wild Frontier,eng
2652,Helen Macdonald,H is for Hawk,H is for Hawk,eng
2653,David Nicholls,Us,Us,eng
2654,R.A. Salvatore,Sojourn (Dark Elf #3),"Sojourn (Forgotten Realms: The Dark Elf Trilogy, #3; Legend of Drizzt, #3)",eng
2655,"Christopher Yost, Orson Scott Card, Pasqual Ferry, Frank D'Armata",,"Ender's Game, Volume 1: Battle School (Ender's Saga)",en-US
2656,"Karuho Shiina, Tomo Kimura",君に届け 1,"Kimi ni Todoke: From Me to You, Vol. 1",eng
2657,Dean Koontz,False Memory,False Memory,en-US
2658,Terry Pratchett,Moving Pictures,"Moving Pictures (Discworld, #10; Industrial Revolution, #1)",eng
2659,C.J. Roberts,Captive in the Dark,"Captive in the Dark (The Dark Duet, #1)",eng
2660,James Allen,,As a Man Thinketh,eng
2661,Mary Roach,Bonk: The Curious Coupling of Science and Sex,Bonk: The Curious Coupling of Science and Sex,en-US
2662,Rachel Caine,Midnight Alley,"Midnight Alley (The Morganville Vampires, #3)",eng
2663,"Nina George, Simon Pare",Das Lavendelzimmer ,The Little Paris Bookshop,eng
2664,Ian McEwan,Sweet Tooth,Sweet Tooth,eng
2665,Abbi Glines,"Twisted Perfection (Perfection, #1)","Twisted Perfection (Rosemary Beach, #5; Perfection, #1)",eng
2666,Tom Clancy,Executive Orders,"Executive Orders (Jack Ryan Universe, #9)",eng
2667,Ann Voskamp,One Thousand Gifts,One Thousand Gifts: A Dare to Live Fully Right Where You Are,eng
2668,Robert Bloch,Psycho,Psycho,eng
2669,Robin Hobb,Ship of Magic,"Ship of Magic (Liveship Traders, #1)",eng
2670,"Alistair MacLean, Clint Willis",Where Eagles Dare ,Where Eagles Dare ,
2671,Maeve Binchy,Circle of Friends,Circle of Friends,eng
2672,Rupi Kaur,milk and honey,Milk and Honey,eng
2673,Tom Clancy,Rainbow Six,"Rainbow Six (Jack Ryan Universe, #10)",en-US
2674,Neil Gaiman,Fragile Things: Short Fictions and Wonders,Fragile Things: Short Fictions and Wonders,eng
2675,Rosamund Lupton,Sister,Sister,eng
2676,"Liu Cixin, Ken Liu",三体,"The Three-Body Problem (Remembrance of Earth’s Past, #1)",eng
2677,Terry Pratchett,Thief of Time,"Thief of Time (Discworld, #26; Death, #5)",eng
2678,"Mark Millar, Kilian Plunkett, Andrew Robinson, Walden Wong, Dave Johnson",Superman: Red Son,Superman: Red Son,eng
2679,Julia Glass,Three Junes,Three Junes,eng
2680,"Benjamin Franklin, Lewis Leary",,The Autobiography of Benjamin Franklin,eng
2681,Timothy J. Keller,The Reason for God: Belief in an Age of Skepticism,The Reason for God: Belief in an Age of Skepticism,eng
2682,Mark  Lawrence,King of Thorns,"King of Thorns (The Broken Empire, #2)",en-US
2683,Jeffrey Archer,The Sins of the Father,"The Sins of the Father (The Clifton Chronicles, #2)",eng
2684,Meg Cabot,Shadowland,"Shadowland (The Mediator, #1)",eng
2685,Sara Shepard,Killer ,"Killer (Pretty Little Liars, #6)",eng
2686,"W. Chan Kim, Renée Mauborgne",Blue Ocean Strategy: How to Create Uncontested Market Space and Make Competition Irrelevant,Blue Ocean Strategy: How To Create Uncontested Market Space And Make The Competition Irrelevant,
2687,James Patterson,Fang,"Fang (Maximum Ride, #6)",eng
2688,Sarah Addison Allen,The Peach Keeper ,The Peach Keeper,en-US
2689,"Audrey Wood, Don    Wood",The Napping House,The Napping House,
2690,Matthew FitzSimmons,,"The Short Drop (Gibson Vaughn, #1)",eng
2691,Christopher Moore,You Suck ,"You Suck (A Love Story, #2)",eng
2692,Jamie McGuire,Beautiful Oblivion,"Beautiful Oblivion (The Maddox Brothers, #1)",eng
2693,Vernor Vinge,A Fire Upon The Deep,"A Fire Upon the Deep (Zones of Thought, #1)",eng
2694,Eckhart Tolle,"Practicing the Power of Now: Essential Teachings, Meditations, and Exercises from The Power of Now","Practicing the Power of Now: Essential Teachings, Meditations, and Exercises from the Power of Now",
2695,Caroline B. Cooney,The Face on the Milk Carton,"The Face on the Milk Carton (Janie Johnson, #1)",en-US
2696,Robert Lopshire,Put Me in the Zoo,Put Me in the Zoo,eng
2697,Sophie Jordan,"Firelight (Firelight, #1)","Firelight (Firelight, #1)",en-US
2698,"Italo Calvino, William Weaver",Le città invisibili,Invisible Cities,eng
2699,Jessica Park,Flat-Out Love ,"Flat-Out Love (Flat-Out Love, #1)",eng
2700,Richard Flanagan,The Narrow Road to the Deep North,The Narrow Road to the Deep North,eng
2701,"A.N. Roquelaure, Anne Rice",The Claiming of Sleeping Beauty,"The Claiming of Sleeping Beauty (Sleeping Beauty, #1)",en-US
2702,Jennifer Worth, Call the midwife : a true story of the East End in the 1950s,"The Midwife: A Memoir of Birth, Joy, and Hard Times",en-US
2703,Hunter S. Thompson,Hell's Angels,Hell's Angels: A Strange and Terrible Saga,fre
2704,Jennifer Weiner,Then Came You,Then Came You,en-US
2705,L.J. Smith,The Awakening,"The Awakening (The Vampire Diaries, #1)",eng
2706,Susan Elizabeth Phillips,It Had to Be You,"It Had to Be You (Chicago Stars, #1)",eng
2707,Michael   Lewis,Boomerang: Travels in the New Third World,Boomerang: Travels in the New Third World,eng
2708,Jennifer Weiner,Fly Away Home,Fly Away Home,eng
2709,"Stendhal, Roger Gard",Le Rouge et le Noir,The Red and the Black,eng
2710,Philippa Gregory,The Virgin's Lover,"The Virgin's Lover (The Plantagenet and Tudor Novels, #13)",en-US
2711,Catherine Fisher,Incarceron,"Incarceron (Incarceron, #1)",eng
2712,C.C. Hunter,Awake at Dawn,"Awake at Dawn (Shadow Falls, #2)",en-US
2713,Bev Vincent,The Road to the Dark Tower: Exploring Stephen King's Magnum Opus,The Road to the Dark Tower: Exploring Stephen King's Magnum Opus,
2714,Josephine Angelini,Starcrossed,"Starcrossed (Starcrossed, #1)",en-US
2715,Alyson Noel,Night Star,"Night Star (The Immortals, #5)",eng
2716,N.H. Kleinbaum,Dead Poets Society ,Dead Poets Society,eng
2717,Emily Bleeker,,Wreckage,en-GB
2718,Terry Pratchett,The Fifth Elephant,"The Fifth Elephant (Discworld, #24; City Watch, #5)",eng
2719,John Flanagan,The Sorcerer in the North,"The Sorcerer in the North (Ranger's Apprentice, #5)",eng
2720,Paramahansa Yogananda,Autobiography of a Yogi,Autobiography of a Yogi,en-US
2721,Kevin Hearne,"Hexed (Iron Druid Chronicles, #2)","Hexed (The Iron Druid Chronicles, #2)",eng
2722,"Alvin Schwartz, Stephen Gammell",Scary Stories to Tell in the Dark,"Scary Stories to Tell in the Dark (Scary Stories, #1)",eng
2723,Harlan Coben,Fool Me Once,Fool Me Once,eng
2724,John Hersey,Hiroshima,Hiroshima,eng
2725,Jennifer Brown,Hate List,Hate List,eng
2726,Kasie West,,The Distance Between Us,eng
2727,Karen Armstrong,"A History of God: The 4,000-Year Quest of Judaism, Christianity, and Islam","A History of God: The 4,000-Year Quest of Judaism, Christianity, and Islam",eng
2728,James S.A. Corey,Abaddon's Gate,"Abaddon's Gate (The Expanse, #3)",eng
2729,"Pablo Neruda, W.S. Merwin, Cristina García",Veinte poemas de amor y una canción desesperada,Twenty Love Poems and a Song of Despair,eng
2730,Tom Clancy,The Cardinal of the Kremlin,"The Cardinal of the Kremlin (Jack Ryan Universe, #5)",en-US
2731,David Shannon,"No, David!","No, David!",en-US
2732,"Thomas More, Paul Turner","Libellus vere aureus, nec minus salutaris quam festivus, de optimo rei publicae statu deque nova insula Utopia",Utopia,eng
2733,"Pseudonymous Bosch, Gilbert Ford",The Name of This Book Is Secret,"The Name of This Book Is Secret (Secret, #1)",en-US
2734,Danielle  Paige,Dorothy Must Die,"Dorothy Must Die (Dorothy Must Die, #1)",eng
2735,Dean Koontz,The Husband,The Husband,eng
2736,Aimee Bender,The Particular Sadness of Lemon Cake,The Particular Sadness of Lemon Cake,eng
2737,James Patterson,The Big Bad Wolf  ,"The Big Bad Wolf  (Alex Cross, #9)",en-US
2738,"Dai Sijie, Ina Rilke",Balzac et la Petite Tailleuse chinoise,Balzac and the Little Chinese Seamstress,en-US
2739,Roxane Gay,Bad Feminist ,Bad Feminist,eng
2740,V.C. Andrews,Petals on the Wind,"Petals on the Wind (Dollanganger, #2)",en-US
2741,"Roald Dahl, Quentin Blake",Danny: The Champion of the World,Danny the Champion of the World,
2742,Amy Chua,,Battle Hymn of the Tiger Mother,eng
2743,Noelle Stevenson,Nimona,Nimona,eng
2744,Giada De Laurentiis,Everyday Italian: 125 Simple and Delicious Recipes,Everyday Italian: 125 Simple and Delicious Recipes,
2745,Patricia Cornwell,From Potter's Field,"From Potter's Field (Kay Scarpetta, #6)",eng
2746,James Patterson,"Mary, Mary","Mary, Mary (Alex Cross, #11)",eng
2747,Jeanette Winterson,Oranges Are Not the Only Fruit,Oranges Are Not the Only Fruit,eng
2748,R.K. Lilley,Grounded (Up In The Air #3),"Grounded (Up in the Air, #3)",en-GB
2749,Ravinder Singh,I Too Had A Love Story,I Too Had a Love Story,eng
2750,"Betty MacDonald, Alexandra Boiger",Mrs. Piggle-Wiggle,"Mrs. Piggle-Wiggle (Mrs. Piggle Wiggle, #1)",eng
2751,Michael Connelly,Trunk Music,"Trunk Music (Harry Bosch, #5; Harry Bosch Universe, #6)",eng
2752,Dan   Harris,"10% Happier: How I Tamed the Voice in My Head, Reduced Stress Without Losing My Edge, and Found Self-Help That Actually Works","10% Happier: How I Tamed the Voice in My Head, Reduced Stress Without Losing My Edge, and Found Self-Help That Actually Works",eng
2753,"Ina Garten, Quentin Bacon",Barefoot Contessa at Home: Everyday Recipes You'll Make Over and Over Again,Barefoot Contessa at Home: Everyday Recipes You'll Make Over and Over Again,
2754,Michael Connelly,Blood Work,"Blood Work (Harry Bosch Universe, #8; Terry McCaleb #1)",eng
2755,Isaac Asimov,The Gods Themselves,The Gods Themselves,eng
2756,Peter Lerangis,,"The Viper's Nest (39 Clues, #7)",eng
2757,Sena Jeter Naslund,,"Ahab's Wife, or The Star-Gazer",en-US
2758,"CLAMP, Anthony Gerard",ツバサ-RESERVoir CHRoNiCLE- 1,"Tsubasa: RESERVoir CHRoNiCLE, Vol. 01",eng
