id,authors,original_title,title,language_code
7490,Orson Scott Card,Prentice Alvin (Tales of Alvin Maker #3),"Prentice Alvin (Tales of Alvin Maker, #3)",en-US
7491,Alexander McCall Smith,44 Scotland Street,"44 Scotland Street (44 Scotland Street, #1)",eng
7492,Sandra Brown,Chill Factor,Chill Factor,en-US
7493,"Neil Gaiman, Mark Buckingham",Odd and the Frost Giants,Odd and the Frost Giants,eng
7494,Mark  Edwards,,The Magpies,eng
7495,"Tayeb Salih, Denys Johnson-Davies",موسم الهجرة إلى الشمال,Season of Migration to the North,eng
7496,Doris Lessing,The Golden Notebook,The Golden Notebook,en-US
7497,Jennifer Donnelly,The Winter Rose,"The Winter Rose (The Tea Rose, #2)",
7498,Jeff Shaara,The Last Full Measure,"The Last Full Measure (The Civil War Trilogy, #3)",eng
7499,Éric-Emmanuel Schmitt,Oscar et la dame rose,Oscar et la dame rose,
7500,Harold S. Kushner,When Bad Things Happen to Good People,When Bad Things Happen to Good People,
7501,Patrick O'Brian,Post Captain,"Post Captain (Aubrey/Maturin, #2)",en-US
7502,Jessica Day George,"Dragon Flight (Dragon Slippers, #2)","Dragon Flight (Dragon Slippers, #2)",en-US
7503,Susan Coolidge,What Katy Did  ,"What Katy Did (Carr Family, #1)",eng
7504,Robert McCloskey,Homer Price,Homer Price (A Puffin Book),eng
7505,Tamora Pierce,Shatterglass,"Shatterglass (The Circle Opens, #4)",eng
7506,David Eddings,The Belgariad: Part One - Pawn of Prophecy / Queen of Sorcery / Magician's Gambit,"The Belgariad, Vol. 1: Pawn of Prophecy / Queen of Sorcery / Magician's Gambit (The Belgariad, #1-3)",eng
7507,Philip G. Zimbardo,The Lucifer Effect: Understanding How Good People Turn Evil,The Lucifer Effect: Understanding How Good People Turn Evil,eng
7508,Nancy Pickard,The Scent of Rain and Lightning,The Scent of Rain and Lightning,eng
7509,"Clive Cussler, Michael Pritchard",Pacific Vortex!,"Pacific Vortex! (Dirk Pitt, #1)",eng
7510,Abbi Glines,One More Chance,"One More Chance (Rosemary Beach, #8; Chance, #2)",eng
7511,Kim Stanley Robinson,Aurora,Aurora,eng
7512,J.D. Robb,Purity in Death,"Purity in Death (In Death, #15)",eng
7513,Mary  Stewart,The Hollow Hills,"The Hollow Hills (Arthurian Saga, #2)",eng
7514,Margaret Peterson Haddix,"Among the Brave (Shadow Children, #5)","Among the Brave (Shadow Children, #5)",en-US
7515,"Rusty Young, Thomas McFadden","Marching Powder: A True Story of Friendship, Cocaine, and South America's Strangest Jail","Marching Powder: A True Story of Friendship, Cocaine, and South America's Strangest Jail",eng
7516,Fuyumi Soryo,マース (Mars) #1,"Mars, Volume 01",eng
7517,Richard Feynman,Six Easy Pieces: Essentials of Physics Explained by Its Most Brilliant Teacher,Six Easy Pieces: Essentials of Physics By Its Most Brilliant Teacher,eng
7518,Alice Waters,The Art of Simple Food: Notes and Recipes from a Delicious Revolution,"The Art of Simple Food: Notes, Lessons, and Recipes from a Delicious Revolution",
7519,Piers Anthony,"Centaur Aisle (Xanth, #4)","Centaur Aisle (Xanth, #4)",
7520,Michelle Richmond,The Year of Fog,The Year of Fog,
7521,"Marv Wolfman, George Pérez",Crisis on Infinite Earths,Crisis on Infinite Earths,en-US
7522,John Hodgman,The Areas of My Expertise,The Areas of My Expertise: An Almanac of Complete World Knowledge Compiled with Instructive Annotation and Arranged in Useful Order,en-US
7523,J.K. Rowling,Hogwarts: An Incomplete and Unreliable Guide,"Hogwarts: An Incomplete and Unreliable Guide (Pottermore Presents, #3)",eng
7524,"Astrid Lindgren, Patricia Crampton, Trina Schart Hyman",Ronja Rövardotter,"Ronia, the Robber's Daughter",eng
7525,Kathy Reichs,Spider Bones,"Spider Bones (Temperance Brennan, #13)",eng
7526,Andrew Clements,No Talking,No Talking,eng
7527,"Jo Nesbø, Neil Smith",Blod på snø,"Blood on Snow (Blood on Snow, #1)",eng
7528,Elisabeth Naughton,Wait for Me,"Wait for Me (Against All Odds, #1)",eng
7529,Tan Twan Eng,The Garden of Evening Mists,The Garden of Evening Mists,eng
7530,Natasha Preston,,"The Cellar (The Cellar, #1)",eng
7531,Arina Tanemura,紳士同盟† 1,"The Gentlemen's Alliance †, Vol. 1",eng
7532,Alice Clayton,,"Rusty Nailed (Cocktail, #2)",eng
7533,Christine Feehan,Dark Guardian,"Dark Guardian (Dark, #9)",en-US
7534,Frank E. Peretti,Prophet,Prophet,en-US
7535,Danielle  Paige,The Wicked Will Rise,"The Wicked Will Rise (Dorothy Must Die, #2)",eng
7536,Christine Feehan,Dark Fire,"Dark Fire (Dark, #6)",eng
7537,Claudia Rankine,Citizen: An American Lyric,Citizen: An American Lyric,eng
7538,P.G. Wodehouse,"Carry On, Jeeves","Carry on, Jeeves (Jeeves, #3)",eng
7539,"Sarah Prineas, Antonio Javier Caparo",The Magic Thief,"The Magic Thief (Magic Thief, #1)",eng
7540,Michael Azerrad,Our Band Could Be Your Life: Scenes from the American Indie Underground 1981-1991,Our Band Could Be Your Life: Scenes from the American Indie Underground 1981-1991,
7541,Rosalind Miles,"I, Elizabeth","I, Elizabeth",en-US
7542,Marian Keyes,The Woman who Stole my Life,The Woman Who Stole My Life,eng
7543,Guy Delisle,Pyongyang,Pyongyang: A Journey in North Korea,eng
7544,Ken Follett,Night over Water,Night Over Water,eng
7545,Courtney Maum,I Am Having So Much Fun Here Without You,I Am Having So Much Fun Here Without You,eng
7546,Cecily von Ziegesar,All I Want Is Everything,"All I Want is Everything (Gossip Girl, #3)",eng
7547,Michael E. Porter,Competitive Strategy: Techniques for Analyzing Industries and Competitors,Competitive Strategy: Techniques for Analyzing Industries and Competitors,
7548,Wayne A. Grudem,Systematic Theology: An Introduction to Biblical Doctrine,Systematic Theology: An Introduction to Biblical Doctrine,
7549,Sue Grafton,"""P"" is for Peril","P is for Peril (Kinsey Millhone, #16)",
7550,Sarah Andersen,"Adulthood Is a Myth: A ""Sarah's Scribbles"" Collection","Adulthood Is a Myth (Sarah's Scribbles, #1)",eng
7551,R. Scott Bakker,The Darkness That Comes Before,"The Darkness That Comes Before (The Prince of Nothing, #1)",eng
7552,Kristin Kimball,"The Dirty Life: On Farming, Food, and Love","The Dirty Life: On Farming, Food, and Love",eng
7553,Jonathan Maberry,Dust & Decay,"Dust & Decay (Rot & Ruin, #2)",eng
7554,Melissa Landers,Alienated,"Alienated (Alienated, #1)",eng
7555,Laura Ruby,Bone Gap,Bone Gap,eng
7556,Adriana Trigiani,"Big Cherry Holler (Big Stone Gap, Book 2)","Big Cherry Holler (Big Stone Gap, #2)",eng
7557,Marcus Samuelsson,,"Yes, Chef",eng
7558,Meg Cabot,Teen Idol,Teen Idol,en-US
7559,Chimamanda Ngozi Adichie,The Thing Around Your Neck,The Thing Around Your Neck,eng
7560,Stephanie Garber,Caraval,Caraval,eng
7561,James Frey,Bright Shiny Morning,Bright Shiny Morning,eng
7562,Kate Chopin,The Story of an Hour,The Story of an Hour,eng
7563,John Updike,Rabbit Is Rich,Rabbit Is Rich (Rabbit Angstrom #3),eng
7564,Anna Quindlen,"Lots of Candles, Plenty of Cake","Lots of Candles, Plenty of Cake",eng
7565,Cheryl Rainfield,Scars,Scars,en-US
7566,Mary Kay Andrews,The Fixer Upper,The Fixer Upper,en-US
7567,Ahmad Fuadi,Negeri 5 Menara,"Negeri 5 Menara (Negeri 5 Menara, #1)",ind
7568,Naomi Novik,Empire of Ivory,"Empire of Ivory (Temeraire, #4)",
7569,Rick Atkinson,"An Army at Dawn: The War in Africa, 1942-1943","An Army at Dawn: The War in North Africa, 1942-1943 (World War II Liberation Trilogy, #1)",eng
7570,Mary Higgins Clark,Daddy's Little Girl,Daddy's Little Girl,
7571,Sandra Brown,Ricochet,Ricochet,eng
7572,Fannie Flagg,Can't Wait to Get to Heaven,Can't Wait to Get to Heaven,eng
7573,Jo Walton,Among Others,Among Others,eng
7574,J.D. Robb,Seduction in Death,"Seduction in Death (In Death, #13)",eng
7575,James M. Cain,Double Indemnity,Double Indemnity,eng
7576,Sherrilyn Kenyon,Upon the Midnight Clear,"Upon the Midnight Clear (Dark-Hunter #12, Dream-Hunter #2)",eng
7577,Garr Reynolds,Presentation Zen: Simple Ideas on Presentation Design and Delivery (Voices That Matter),Presentation Zen: Simple Ideas on Presentation Design and Delivery,
7578,R.A. Salvatore, ,"Sea of Swords (Forgotten Realms: Paths of Darkness, #4; Legend of Drizzt, #13)",eng
7579,Philip Roth,"Goodbye, Columbus and Five Short Stories","Goodbye, Columbus and Five Short Stories",
7580,"Tom Sniegoski, Jeff Smith, Thomas E. Sniegoski, Steve Hamaker","Bone: Quest For The Spark, Book One ","Bone: Quest for the Spark, Vol. 1",eng
7581,Josh Kaufman,,The Personal MBA: Master the Art of Business,
7582,Dorothea Benton Frank,,The Last Original Wife,eng
7583,Sherrilyn Kenyon,No Mercy,"No Mercy (Dark-Hunter #18, Were-Hunter, #5)",en-US
7584,Scott  Hawkins,The Library at Mount Char,The Library at Mount Char,eng
7585,Chris d'Lacey,Fire Star,"Fire Star (The Last Dragon Chronicles, #3)",eng
7586,James A. Michener,Texas,Texas,
7587,Joel Osteen,Your Best Life Now: 7 Steps to Living at Your Full Potential,Your Best Life Now: 7 Steps to Living at Your Full Potential,
7588,Jennifer L. Holm,,Turtle in Paradise,en-US
7589,Lois McMaster Bujold,The Vor Game,"The Vor Game (Vorkosigan Saga, #6)",eng
7590,"Mary Beth Chapman, Steven Curtis Chapman",,Choosing to SEE,
7591,Lauren Beukes,Broken Monsters,Broken Monsters,eng
7592,"Sylvia Plath, Karen V. Kukil",The Journals of Sylvia Plath,The Unabridged Journals of Sylvia Plath,eng
7593,David Foster Wallace,This is Water,"This Is Water: Some Thoughts, Delivered on a Significant Occasion, about Living a Compassionate Life",eng
7594,Richard Feynman,QED: The Strange Theory of Light and Matter,QED: The Strange Theory of Light and Matter,
7595,"Lili St. Crow, Lilith Saintcrow",Defiance,"Defiance (Strange Angels, #4)",
7596,Kelley Armstrong,Haunted,"Haunted (Women of the Otherworld, #5)",eng
7597,Jill Conner Browne,The Sweet Potato Queens' Book of Love,The Sweet Potato Queens' Book of Love,eng
7598,Tamora Pierce,Mastiff,"Mastiff (Beka Cooper, #3)",en-US
7599,Debra Dean,The Madonnas of Leningrad,The Madonnas of Leningrad,
7600,Laurell K. Hamilton,Divine Misdemeanors ,"Divine Misdemeanors (Merry Gentry, #8)",eng
7601,Chelsea Cain,Sweetheart,"Sweetheart (Archie Sheridan & Gretchen Lowell, #2)",en-US
7602,José Saramago,Caim,Caim,por
7603,William Gibson,All Tomorrow's Parties,"All Tomorrow's Parties (Bridge, #3)",en-US
7604,Hannu Rajaniemi,The Quantum Thief,"The Quantum Thief (Jean le Flambeur, #1)",eng
7605,John Sandford,Shock Wave,"Shock Wave (Virgil Flowers, #5)",eng
7606,Ludwig Wittgenstein,Logisch-Philosophische Abhandlung,Tractatus Logico-Philosophicus,en-US
7607,Agatha Christie,Lord Edgware Dies,"Lord Edgware Dies (Hercule Poirot, #9)",eng
7608,"Jeph Loeb, Jim Lee, Scott Williams",Batman (Volume 2): Hush,"Batman: Hush, Vol. 2",eng
7609,Spencer Quinn,Dog on It,Dog on It (A Chet and Bernie Mystery #1),en-US
7610,Mary Kay Andrews,,Spring Fever,en-US
7611,Dr. Seuss,And to Think That I Saw It on Mulberry Street,And to Think That I Saw it on Mulberry Street,en-US
7612,Doris Kearns Goodwin,"The Bully Pulpit: Theodore Roosevelt, William Howard Taft, and the Golden Age of Journalism","The Bully Pulpit: Theodore Roosevelt, William Howard Taft, and the Golden Age of Journalism",eng
7613,Brandon Mull,"Chasing the Prophecy (Beyonders, #3)","Chasing the Prophecy (Beyonders, #3)",eng
7614,David Weber,The Short Victorious War,"The Short Victorious War (Honor Harrington, #3)",
7615,Caroline Knapp,Drinking: A Love Story,Drinking: A Love Story,
7616,Jules Verne,Cinq semaines en ballon,"Five Weeks in a Balloon (Extraordinary Voyages, #1)",
7617,"P.C. Cast, Kristin Cast",Dragon's Oath,"Dragon's Oath (House of Night Novellas, #1)",en-US
7618,Kalayna Price,Grave Witch,"Grave Witch (Alex Craft, #1)",en-US
7619,Agatha Christie,Sleeping Murder,"Sleeping Murder (Miss Marple, #13)",eng
7620,"Edith Wharton, Mary Gordon",Ethan Frome and Other Short Fiction,Ethan Frome and Other Short Fiction,en-US
7621,Sarah J. Maas,The Assassin and the Desert,"The Assassin and the Desert (Throne of Glass, #0.3)",eng
7622,"Friedrich Nietzsche, Walter Kaufmann, R.J. Hollingdale",On the Genealogy of Morals / Ecce Homo,On the Genealogy of Morals/Ecce Homo,en-US
7623,Steven Callahan,Adrift: Seventy-Six Days Lost at Sea,Adrift: Seventy-Six Days Lost at Sea,en-US
7624,Judith McNaught,Once and Always,"Once and Always (Sequels, #1)",eng
7625,James Rollins,Bloodline,"Bloodline (Sigma Force, #8)",eng
7626,Lisi Harrison,"Best Friends for Never (The Clique, #2)","Best Friends for Never (The Clique, #2)",
7627,Bernard Cornwell,Death of Kings,"Death of Kings (The Saxon Stories, #6)",eng
7628,"Howard Schultz, Joanne Gordon",Onward: How Starbucks Fought for Its Life without Losing Its Soul,Onward: How Starbucks Fought for Its Life without Losing Its Soul,en-CA
7629,Laurence Rees,Auschwitz: A New History,Auschwitz,eng
7630,Slavomir Rawicz,The Long Walk: The True Story of a Trek to Freedom,The Long Walk: The True Story of a Trek to Freedom,eng
7631,Nora Roberts,Three Fates,Three Fates,eng
7632,Alexandra Bracken,Passenger,"Passenger (Passenger, #1)",eng
7633,"J.D. Robb, Susan Ericksen","Born in Death (In Death, #23)","Born in Death (In Death, #23)",en-US
7634,Chris Bohjalian,"Close Your Eyes, Hold Hands","Close Your Eyes, Hold Hands",eng
7635,Agatha Christie,A Pocket Full of Rye,"A Pocket Full of Rye (Miss Marple, #7)",eng
7636,"Durjoy Datta, Maanvi Ahuja",of course i love you,Of Course I Love You...! Till I Find Someone Better...,en-GB
7637,Robyn Carr,Virgin River,"Virgin River (Virgin River, #1)",
7638,Iain M. Banks,The Algebraist,The Algebraist,eng
7639,"José Mauro de Vasconcelos, قاسم صنعوی",Meu Pé de Laranja Lima,درخت زیبای من,per
7640,Margaret Atwood,Stone Mattress,Stone Mattress: Nine Tales,eng
7641,Ivan Doig,The Whistling Season,The Whistling Season,
7642,"Morgan Rhodes, Michelle Rowen",Rebel Spring,"Rebel Spring (Falling Kingdoms, #2)",eng
7643,"James Patterson, Marshall Karp",NYPD Red 2,"NYPD Red 2 (NYPD Red, #2)",eng
7644,James A. Michener,Chesapeake,Chesapeake,en-US
7645,Steve Martini,The List,The List,eng
7646,Gloria Levine,,Ralph S. Mouse by Beverly Cleary: Teacher Guide (Novel Units),
7647,Walter Mosley,Devil in a Blue Dress,"Devil in a Blue Dress (Easy Rawlins, #1)",eng
7648,"Michael Rosen, Jane Ray",Shakespeare's Romeo and Juliet,Shakespeare's Romeo and Juliet,
7649,Jim Thompson,The Killer Inside Me,The Killer Inside Me,
7650,Mary Elizabeth Braddon,Lady Audley's Secret,Lady Audley's Secret,eng
7651,"José Saramago, Margaret Jull Costa",Todos os Nomes,All the Names,en-US
7652,Adriana Trigiani,"Lucia, Lucia","Lucia, Lucia",eng
7653,Jodi Lynn Anderson,Tiger Lily,Tiger Lily,eng
7654,"Karen Kingsbury, Gary Smalley",Return,"Return (Redemption, #3)",eng
7655,Philip Pullman,The Ruby in the Smoke,"The Ruby in the Smoke (Sally Lockhart, #1)",en-US
7656,Amanda Foreman,Georgiana: Duchess of Devonshire,Georgiana: Duchess of Devonshire,en-US
7657,A.C. Gaughen,Scarlet,"Scarlet (Scarlet, #1)",eng
7658,Miranda Kenneally,Stealing Parker,Stealing Parker,en-US
7659,Mary Kay Andrews,,The Weekenders,
7660,"Bill Willingham, Mark Buckingham, Steve Leialoha, Tony Akins, Jimmy Palmiotti","Fables, Volume 5: The Mean Seasons","Fables, Vol. 5: The Mean Seasons",eng
7661,Machado de Assis,Dom Casmurro,Dom Casmurro,por
7662,"Robert Shea, Robert Anton Wilson",The Illuminatus! Trilogy,The Illuminatus! Trilogy,eng
7663,Alexander Gordon Smith,Lockdown,"Lockdown (Escape from Furnace, #1)",en-US
7664,"Michael Chabon, Jay Ryan",The Final Solution: A Story of Detection,The Final Solution,en-US
7665,Nancy Thayer,,Beachcombers,en-US
7666,"John Layman, Rob Guillory",International Flavor,"Chew, Vol. 2: International Flavor",eng
7667,Poppy Z. Brite,Lost Souls,Lost Souls,eng
7668,Joseph Conrad,The Secret Agent: A Simple Tale,The Secret Agent,
7669,Alan W. Watts,The Way of Zen,The Way of Zen,eng
7670,Ramez Naam,Nexus,"Nexus (Nexus, #1)",eng
7671,Kathleen E. Woodiwiss,The wolf and the dove,The Wolf and the Dove,
7672,Veronica Roth,,"The Traitor (Divergent, #0.4)",eng
7673,Colm Tóibín,Nora Webster,Nora Webster,eng
7674,Jamie McGuire,Requiem (Providence #2),"Requiem (Providence, #2)",eng
7675,Steve Berry,The Emperor's Tomb,"The Emperor's Tomb (Cotton Malone, #6)",en-US
7676,Lisa Gardner,Fear Nothing,"Fear Nothing (Detective D.D. Warren, #7)",eng
7677,"Dorie Greenspan, Alan    Richardson",Baking: From My Home to Yours,Baking: From My Home to Yours,en-US
7678,Jane Green,,Promises to Keep,en-US
7679,Kristen Ashley,For You,"For You (The 'Burg, #1)",eng
7680,"Aya Nakahara, Pookie Rolf",ラブ★コン 1,"Love★Com, Vol. 1",eng
7681,Agatha Christie,Elephants Can Remember,"Elephants Can Remember (Hercule Poirot, #37)",eng
7682,Belle Aurora,,"Friend-Zoned (Friend-Zoned, #1)",eng
7683,"Heidi Murkoff, Sharon Mazel, Heidi Murkoff, Arlene Eisenberg, Sandee Hathaway, Mark D. Widome",What to Expect the First Year,What to Expect the First Year (What to Expect),eng
7684,Danielle Steel,The Gift,The Gift,en-US
7685,Kristin Levine,The Lions of Little Rock,The Lions of Little Rock,eng
7686,Phillip C. McGraw,Self Matters: Creating Your Life from the Inside Out,Self Matters: Creating Your Life from the Inside Out,en-US
7687,Amanda Hocking,,"Hollowland (The Hollows, #1)",eng
7688,Hidekaz Himaruya,ヘタリア 1 Axis Powers,"Hetalia: Axis Powers, Vol. 1 (Hetalia: Axis Powers, #1)",en-US
7689,"Andrew Stanton, Walt Disney Company",Finding Nemo,Finding Nemo,
7690,"Herman Parish, Lynn Sweat",Calling Doctor Amelia Bedelia (I Can Read Book 2),Calling Doctor Amelia Bedelia,
7691,Gail Carriger,Timeless,"Timeless (Parasol Protectorate, #5)",eng
7692,Jan Karon,"These High, Green Hills","These High, Green Hills (Mitford Years, #3)",
7693,"Eric Schmidt, Jonathan Rosenberg",How Google Works,How Google Works,en-CA
7694,J.A. Redmerski,Killing Sarai,"Killing Sarai (In the Company of Killers, #1)",eng
7695,Cecelia Ahern,The Time of My Life,The Time of My Life,eng
7696,"A.A. Milne, Ernest H. Shepard",Now We Are Six,"Now We Are Six (Winnie-the-Pooh, #4)",eng
7697,L.J. Smith,The Secret Circle: The Captive Part II and The Power,"The Captive Part II / The Power (The Secret Circle, #2-3)",eng
7698,Mary Kay Andrews,Ladies' Night ,Ladies' Night,en-US
7699,Jane Green,Family Pictures,Family Pictures ,eng
7700,Lara Adrian,"Taken by Midnight (Midnight Breed, #8)","Taken by Midnight (Midnight Breed, #8)",eng
7701,"José Maria de Eça de Queirós, Ester de Lemos",Os Maias,Os Maias,por
7702,Amy Harmon,The Law of Moses,"The Law of Moses (The Law of Moses, #1)",eng
7703,Amy Gentry,Good as Gone,Good as Gone,eng
7704,Nora Roberts,Holding the Dream,Holding the Dream (Dream Trilogy #2),en-US
7705,Tijan,,"Fallen Crest Family (Fallen Crest High, #2)",en-US
7706,Amanda Grange,Mr. Darcy's Diary,"Mr. Darcy's Diary (Jane Austen Heroes, #1)",en-GB
7707,Robert Crais,L.A. Requiem,"L.A. Requiem (Elvis Cole, #8)",fre
7708,Joshilyn Jackson,,A Grown-Up Kind of Pretty,eng
7709,Miranda Hart,,Is It Just Me?,eng
7710,Kent Haruf,Eventide,"Eventide (Plainsong, #2)",eng
7711,"Tim Hamilton, Ray Bradbury",Fahrenheit 451: The Authorized Adaptation,Fahrenheit 451: The Authorized Adaptation,eng
7712,Maki Minami,スペシャル·エー,"Special A, Vol. 1 (Special A, #1)",ind
7713,"Hiroshi Sakurazaka, 桜坂洋, Alexander O. Smith, Joseph Reeder",オール・ユー・ニード・イズ・キル,All You Need Is Kill,eng
7714,Elizabeth George Speare,The Bronze Bow,The Bronze Bow,en-US
7715,Alain de Botton,Essays in Love,On Love,eng
7716,Jonathan Harr,A Civil Action,A Civil Action,en-US
7717,Wanda Gág,Millions of Cats,Millions of Cats,
7718,Christine Feehan,Dark challenge,"Dark Challenge (Dark, #5)",
7719,"James Patterson, David Ellis",Mistress,Mistress,
7720,Allen Say,Grandfather's Journey,Grandfather's Journey,en-US
7721,Mary Kay Andrews,Savannah Blues,"Savannah Blues (Weezie and Bebe Mysteries, #1)",en-US
7722,James Rollins,Excavation,Excavation,en-US
7723,"René Descartes, Donald A. Cress",,Discourse on Method,eng
7724,Matthew Reilly,Scarecrow,"Scarecrow (Shane Schofield, #3)",eng
7725,Kiersten White,Endlessly,"Endlessly (Paranormalcy, #3)",eng
7726,Ella Carey,,The House by the Lake,en-US
7727,Thich Nhat Hanh,"Living Buddha, Living Christ","Living Buddha, Living Christ",eng
7728,Ursula K. Le Guin,The Earthsea Trilogy,The Earthsea Trilogy,eng
7729,Jessica Park,Left Drowning,"Left Drowning (Left Drowning, #1)",eng
7730,"Philip C. Stead, Erin E. Stead",A Sick Day for Amos McGee,A Sick Day for Amos McGee,en-US
7731,Smith Henderson,Fourth of July Creek,Fourth of July Creek,eng
7732,Lisa Jackson,Absolute Fear,"Absolute Fear (New Orleans, #4)",en-US
7733,Greg Iles,True Evil,True Evil,eng
7734,"Erskine Caldwell, Lewis Nordan",Tobacco Road,Tobacco Road (Brown Thrasher Books),en-US
7735,Kate Summerscale,The Suspicions of Mr. Whicher: Murder and the Undoing of a Great Victorian Detective,The Suspicions of Mr. Whicher: A Shocking Murder and the Undoing of a Great Victorian Detective,en-US
7736,Loretta Chase,Lord of Scoundrels,"Lord of Scoundrels (Scoundrels, #3)",eng
7737,L. Frank Baum,Ozma of Oz,"Ozma of Oz (Oz, #3)",eng
7738,David McCullough,The Johnstown Flood,The Johnstown Flood,eng
7739,Glenn Beck,The Christmas Sweater,The Christmas Sweater,eng
7740,Rachel Renée Russell,Tales From a Not-So-Happy-Heartbreaker,"Tales from a Not-So-Happy Heartbreaker (Dork Diaries, #6)",eng
7741,James Rollins,Deep Fathom,Deep Fathom,eng
7742,Nelson DeMille,The Gate House,The Gate House,en-US
7743,"J. Lynn, Jennifer L. Armentrout",Stay with Me,"Stay with Me (Wait for You, #3)",eng
7744,Sylvia Day,Seven Years to Sin,Seven Years to Sin,en-US
7745,Ally Carter,Perfect Scoundrels,"Perfect Scoundrels (Heist Society, #3)",en-GB
7746,"Larry Bird, Earvin Johnson, Jackie MacMullan",When the Game Was Ours,When the Game Was Ours,en-US
7747,R.A. Salvatore,The Two Swords (Hunter's Blades #3),"The Two Swords (Forgotten Realms: Hunter's Blades, #3; Legend of Drizzt, #16)",en-GB
7748,Agatha Christie,Nemesis,"Nemesis (Miss Marple, #12)",eng
7749,Douglas Coupland,All Families Are Psychotic,All Families are Psychotic,
7750,Tony Hillerman,The Blessing Way,"The Blessing Way (Leaphorn & Chee, #1)",en-US
7751,Jane Green,Another Piece of My Heart,Another Piece of My Heart,eng
7752,Camilla Läckberg,Stenhuggaren,"Stenhuggaren (Patrik Hedström, #3)",swe
7753,Mo Willems,The Pigeon Wants a Puppy!,The Pigeon Wants a Puppy!,en-US
7754,David  Brooks,The Road to Character,The Road to Character,eng
7755,"Gabriel García Márquez, Edith Grossman",El general en su laberinto,The General in His Labyrinth,eng
7756,Mario Vargas Llosa,La ciudad y los perros,La ciudad y los perros,spa
7757,Cammie McGovern,Amy & Matthew,Say What You Will,eng
7758,Tess Gerritsen,Die Again,"Die Again (Rizzoli & Isles, #11)",eng
7759,Meg Cabot,Party Princess,"Party Princess (The Princess Diaries, #7)",
7760,H.M. Ward,,"Damaged 2 (Damaged, #2)",eng
7761,Sandra Brown,Witness,The Witness,eng
7762,Susan Abulhawa,The Scar of David,Mornings in Jenin,
7763,Melissa Nathan,The Nanny,The Nanny,
7764,Katy Evans,Manwhore,"Manwhore (Manwhore, #1)",eng
7765,Peter Clines,Ex-Heroes,"Ex-Heroes (Ex-Heroes, #1)",
7766,Alastair Reynolds,Absolution Gap,Absolution Gap,en-GB
7767,Enid Blyton,"The Faraway Tree Stories (The Enchanted Wood, The Faraway Tree, The Folk of the Faraway Tree)",The Faraway Tree Stories (The Faraway Tree #1-3),eng
7768,Misty Bernall,She Said Yes: The Unlikely Martyrdom of Cassie Bernall,She Said Yes: The Unlikely Martyrdom of Cassie Bernall,eng
7769,Evelyn Waugh,Scoop,Scoop,eng
7770,Rita Golden Gelman,Tales of a Female Nomad: Living at Large in the World,Tales of a Female Nomad: Living at Large in the World,eng
7771,Lorrie Moore,Birds of America: Stories,Birds of America,eng
7772,Lauren Blakely,Big Rock,Big Rock,eng
7773,Kendare Blake,Three Dark Crowns,"Three Dark Crowns (Three Dark Crowns, #1)",eng
7774,Elizabeth Bard,"Lunch in Paris: A Love Story, with Recipes","Lunch in Paris: A Love Story, with Recipes",eng
7775,John Jakes,Love and War ,"Love and War (North and South, #2)",eng
7776,Aprilynne Pike,Destined,"Destined (Wings, #4)",en-US
7777,"David Foster Wallace, Michael Pietsch",The Pale King,The Pale King,en-US
7778,"Confucius, D.C. Lau",論語 [Lún Yǔ],The Analects,eng
7779,"Pamela Des Barres, Dave Navarro",I'm with the Band: Confessions of a Groupie,I'm with the Band: Confessions of a Groupie,en-US
7780,Richelle Mead,Succubus Heat,"Succubus Heat (Georgina Kincaid, #4)",en-GB
7781,"Robert Kirkman, Charlie Adlard, Cliff Rathburn","The Walking Dead, Vol. 9: Here We Remain","The Walking Dead, Vol. 09: Here We Remain",en-GB
7782,Mariana Zapata,Under Locke,Under Locke,eng
7783,"Giuseppe Tomasi di Lampedusa, Archibald Colquhoun",Il Gattopardo,The Leopard,eng
7784,"Paul Jenkins, Andy Kubert, Richard Isanove, Joe Quesada, Bill Jemas",Wolverine: Origin,Wolverine: Origin,eng
7785,V.C. Andrews,Dawn ,"Dawn (Cutler, #1)",eng
7786,"Patricia Briggs, Eileen Wilks, Karen Chance, Sunny",On the Prowl,"On the Prowl (Alpha & Omega, #0.5)",eng
7787,John Sandford,Silent Prey,Silent Prey (Lucas Davenport #4),en-US
7788,Sara Douglass,Battleaxe (The Axis Trilogy #1),"The Wayfarer Redemption (Wayfarer Redemption, #1)",eng
7789,Sandra Gulland,The Many Lives & Secret Sorrows of Josephine B.,"The Many Lives & Secret Sorrows of Josephine B. (Josephine Bonaparte, #1)",
7790,حسن الجندي,الجزار,الجزار,ara
7791,Lisa Scottoline,Come Home,Come Home,
7792,Adam Gidwitz,A Tale Dark and Grimm,"A Tale Dark & Grimm (A Tale Dark & Grimm, #1)",en-US
7793,Trudi Canavan,The Ambassador's Mission,"The Ambassador's Mission (Traitor Spy Trilogy, #1)",en-US
7794,Philip Roth,Everyman,Everyman,eng
7795,Dee Lestari,Supernova: Akar,Supernova: Akar,ind
7796,"Alisa Valdes, Alisa Valdes-Rodriguez",The Dirty Girls Social Club,"The Dirty Girls Social Club (Dirty Girls, #1)",
7797,L.J. Smith,Dark Reunion,"Dark Reunion (The Vampire Diaries, #4)",eng
7798,Luke Rhinehart,The Dice Man,The Dice Man,eng
7799,"Yana Toboso, Tomo Kimura",黒執事 II [Kuroshitsuji II],"Black Butler, Vol. 2 (Black Butler, #2)",eng
7800,Bret Easton Ellis,Imperial Bedrooms,Imperial Bedrooms ,en-US
7801,"Krista Ritchie, Becca Ritchie",Addicted to You,"Addicted to You (Addicted, #1)",eng
