id,authors,original_title,title,language_code
4808,Charlie N. Holmberg,The Glass Magician,"The Glass Magician (The Paper Magician Trilogy, #2)",
4809,Ashwin Sanghi,Chanakya's Chant,Chanakya's Chant,eng
4810,Norman Mailer,The Naked and the Dead,The Naked and the Dead,eng
4811,James M. McPherson,Battle Cry of Freedom,Battle Cry of Freedom,eng
4812,"Michael Teitelbaum, Sue DiCicco",The Little Mermaid (Little Golden Storybook),The Little Mermaid,
4813,"James Patterson, Andrew Gross",Lifeguard,Lifeguard,
4814,Rob Buyea,,Because of Mr. Terupt,eng
4815,Judy Blume,Blubber,Blubber,en-GB
4816,Jeaniene Frost,"One Grave at a Time (Night Huntress, #6)","One Grave at a Time (Night Huntress, #6)",eng
4817,Jennifer L. Armentrout,Apollyon,"Apollyon (Covenant, #4)",eng
4818,Lindsey Kelk,I Heart New York,"I Heart New York (I Heart, #1)",en-US
4819,Meg Cabot,Airhead ,"Airhead (Airhead, #1)",eng
4820,"A.N. Roquelaure, Anne Rice","Beauty's Release (Sleeping Beauty, #3)","Beauty's Release (Sleeping Beauty, #3)",eng
4821,Beth Fantaskey,Jessica's Guide to Dating on the Dark Side,"Jessica's Guide to Dating on the Dark Side (Jessica, #1)",en-US
4822,E.E. Cummings,E.E. Cummings: Complete Poems 1904-1962,"Complete Poems, 1904-1962",eng
4823,"Larry Bossidy, Ram Charan, Charles Burck",,Execution: The Discipline of Getting Things Done,en-US
4824,Caitlin Doughty,Smoke Gets in Your Eyes: And Other Lessons from the Crematory,Smoke Gets in Your Eyes: And Other Lessons from the Crematory,eng
4825,Daniel Silva,The Rembrandt Affair,"The Rembrandt Affair (Gabriel Allon, #10)",eng
4826,H.P. Lovecraft,The Call of Cthulhu,The Call of Cthulhu,eng
4827,"Joe Hill, Christopher Golden",20th Century Ghosts,20th Century Ghosts,en-US
4828,David Mitchell,Ghostwritten,Ghostwritten,eng
4829,Simon Wood,The One That Got Away,The One That Got Away,eng
4830,Richelle Mead,The Ruby Circle,"The Ruby Circle (Bloodlines, #6)",eng
4831,Grace Lin,Where the Mountain Meets the Moon,Where the Mountain Meets the Moon,eng
4832,Arthur Ransome,Swallows and Amazons,"Swallows and Amazons (Swallows and Amazons, #1)",eng
4833,Olivia Cunning,Rock Hard,"Rock Hard (Sinners on Tour, #2)",eng
4834,Caitlin Moran,How to Build a Girl,How to Build a Girl,eng
4835,Andrea Hirata,Sang Pemimpi,"Sang Pemimpi (Tetralogi Laskar Pelangi, #2)",ind
4836,A.J. Jacobs,The Know-It-All: One Man's Humble Quest to Become the Smartest Person in the World,The Know-It-All: One Man's Humble Quest to Become the Smartest Person in the World,eng
4837,Lisa Gardner,,"Touch & Go (Tessa Leoni, #2)",eng
4838,Chris Bohjalian,The Double Bind,The Double Bind,eng
4839,Mary Kay Andrews,,Summer Rental,en-US
4840,S.K. Tremayne,The Ice Twins,The Ice Twins,eng
4841,J.A. Redmerski,The Edge of Always,"The Edge of Always (The Edge of Never, #2)",eng
4842,Tracy Chevalier,The Virgin Blue,The Virgin Blue,eng
4843,Michael Moss,Salt Sugar Fat: How the Food Giants Hooked Us ,Salt Sugar Fat: How the Food Giants Hooked Us,eng
4844,"Edward Eager, N.M. Bodecker",Half Magic,"Half Magic (Tales of Magic, #1)",en-US
4845,"Steve Hockensmith, Jane Austen, Patrick Arrasmith","Dawn of the Dreadfuls (Pride and Prejudice and Zombies, #0.5)","Dawn of the Dreadfuls (Pride and Prejudice and Zombies, #0.5)",eng
4846,Lisa Gardner,Live To Tell,"Live to Tell (Detective D.D. Warren, #4)",eng
4847,Kevin Henkes,Lilly's Purple Plastic Purse,Lilly's Purple Plastic Purse,
4848,Helene Hanff,"84, Charing Cross Road","84, Charing Cross Road",eng
4849,J.R. Ward,,"Father Mine (Black Dagger Brotherhood, #6.5)",eng
4850,"Thich Nhat Hanh, Arnold Kotler, Dalai Lama XIV",Peace Is Every Step: The Path of Mindfulness in Everyday Life,Peace Is Every Step: The Path of Mindfulness in Everyday Life,eng
4851,Kyousuke Motomi,電撃デイジー 1,"Electric Daisy, Vol. 1 (Dengeki Daisy, #1)",ind
4852,Anna Kendrick,Scrappy Little Nobody,Scrappy Little Nobody,eng
4853,Robert Masello,,The Einstein Prophecy,en-US
4854,Kate Atkinson,"Started Early, Took My Dog","Started Early, Took My Dog (Jackson Brodie, #4)",eng
4855,"Jim Starlin, Jim Aparo, Mike DeCarlo",Batman: A Death in the Family,Batman: A Death in the Family,eng
4856,Colum McCann,TransAtlantic,TransAtlantic,eng
4857,Jeaniene Frost,Eternal Kiss of Darkness,"Eternal Kiss of Darkness (Night Huntress World, #2)",en-GB
4858,Lisa Lutz,The Spellman Files,"The Spellman Files (The Spellmans, #1)",eng
4859,Clive Barker,Books of Blood: Volumes 1-3,Books of Blood: Volumes One to Three (Books of Blood #1-3),eng
4860,James Rollins,The Judas Strain,"The Judas Strain (Sigma Force, #4)",eng
4861,Donald Miller,Searching for God Knows What,Searching for God Knows What,en-US
4862,Shel Silverstein,The Missing Piece,The Missing Piece,
4863,Robert   Harris,Fatherland,Fatherland,eng
4864,Daniel Suarez,Freedom™,"Freedom™ (Daemon, #2)",en-US
4865,Thornton Wilder,The Bridge of San Luis Rey,The Bridge of San Luis Rey,en-US
4866,Fyodor Dostoyevsky,Белые ночи,White Nights,eng
4867,Laurell K. Hamilton,Skin Trade,"Skin Trade (Anita Blake, Vampire Hunter #17)",en-US
4868,James E. Talmage,Jesus the Christ: A Study of the Messiah and His Mission according to Holy Scriptures both Ancient and Modern,Jesus the Christ,
4869,Don Ferguson,Disney's the Lion King (Disney Classic Series),Disney's the Lion King,en-US
4870,"Charlotte Brontë, Lucasta Miller, collaborative, Jessica Cox",Shirley ,Shirley,
4871,Nora Roberts,Born in Ice,"Born in Ice (Born In Trilogy, #2)",en-US
4872,Tom Robbins,Villa Incognito,Villa Incognito,
4873,Paul Beatty,The Sellout,The Sellout,eng
4874,"Bill Willingham, Mark Buckingham, Craig Hamilton, Steve Leialoha, P. Craig Russell","Fables, Volume 4: March of the Wooden Soldiers","Fables, Vol. 4: March of the Wooden Soldiers",eng
4875,"Lee Child, Dick Hill",Night School,Night School,eng
4876,Tess Gerritsen,The Silent Girl,"The Silent Girl (Rizzoli & Isles, #9)",en-US
4877,Dr. Seuss,Horton Hatches the Egg,Horton Hatches the Egg,eng
4878,Bella Forrest,,"A Shade of Blood (A Shade of Vampire, #2)",eng
4879,"Jenna Miscavige Hill, Lisa Pulitzer",Beyond Belief: My Secret Life Inside Scientology and My Harrowing Escape,Beyond Belief: My Secret Life Inside Scientology and My Harrowing Escape,eng
4880,"Plato, James J. Helm",Απολογία,Apology,eng
4881,"Garth Ennis, Steve Dillon, Penn Jillette",Preacher: Proud Americans,"Preacher, Volume 3: Proud Americans",eng
4882,Anne Rice,The Wolf Gift,"The Wolf Gift (The Wolf Gift Chronicles, #1)",eng
4883,"Diane Muldrow, J.P. Miller",The Little Red Hen (Little Golden Book),The Little Red Hen (Little Golden Book),
4884,Sandra Brown,Lethal,Lethal,
4885,Dan Simmons,The Terror,The Terror,eng
4886,Ludwig Bemelmans,Madeline's Rescue,Madeline's Rescue,eng
4887,"John Heilemann, Mark Halperin","Game Change: Obama and the Clintons, McCain and Palin, and the Race of a Lifetime","Game Change: Obama and the Clintons, McCain and Palin, and the Race of a Lifetime",
4888,V.C. Andrews,Garden of Shadows,"Garden of Shadows (Dollanganger, #5)",eng
4889,Kim Harrison,A Perfect Blood,"A Perfect Blood (The Hollows, #10)",en-US
4890,"Joni Eareckson Tada, Joe Musser",Joni,Joni: An Unforgettable Story,en-US
4891,"Margaret Weis, Tracy Hickman",War of the Twins,"War of the Twins (Dragonlance: Legends, #2)",eng
4892,James Patterson,Cross Fire,"Cross Fire (Alex Cross, #17)",eng
4893,Ross King,Brunelleschi's Dome: How a Renaissance Genius Reinvented Architecture,Brunelleschi's Dome: How a Renaissance Genius Reinvented Architecture,en-US
4894,Shakti Gawain,Creative Visualization: Use the Power of Your Imagination to Create What You Want in Your Life,Creative Visualization: Use the Power of Your Imagination to Create What You Want in Your Life,eng
4895,Janet Evanovich,Metro Girl,"Metro Girl (Alex Barnaby, #1)",eng
4896,"Colleen Hoover, Tarryn Fisher",,"Never Never: Part Three (Never Never, #3)",en-GB
4897,Darynda Jones,Second Grave on the Left,"Second Grave on the Left (Charley Davidson, #2)",en-US
4898,"Anya Seton, Philippa Gregory",Katherine,Katherine,eng
4899,Marina Lewycka,A Short History of Tractors in Ukrainian,A Short History of Tractors in Ukrainian,en-US
4900,Kimberly McCreight,,Where They Found Her,eng
4901,Kelley Armstrong,Industrial Magic,"Industrial Magic (Women of the Otherworld, #4)",en-US
4902,"René Goscinny, Jean-Jacques Sempé",Le Petit Nicolas,"Le Petit Nicolas (Le petit Nicolas, #1)",fre
4903,A.G. Riddle,The Atlantis Plague,"The Atlantis Plague (The Origin Mystery, #2)",eng
4904,"Harold G. Moore, Joseph L. Galloway",We Were Soldiers Once... and Young: Ia Drang - the Battle That Changed the War in Vietnam,We Were Soldiers Once... and Young: Ia Drang - The Battle that Changed the War in Vietnam,eng
4905,Ken Follett,Whiteout,Whiteout,en-US
4906,Barbara W. Tuchman,A Distant Mirror: The Calamitous 14th Century,A Distant Mirror:  The Calamitous 14th Century,eng
4907,Mike Lupica,Heat,Heat,en-US
4908,Neil Strauss,The Game,The Game: Penetrating the Secret Society of Pickup Artists,en-US
4909,Sue Grafton,"""N"" is for Noose","N is for Noose (Kinsey Millhone, #14)",eng
4910,Julia Quinn,Just Like Heaven,Just Like Heaven (Smythe-Smith Quartet #1),en-GB
4911,"Rick Riordan, Tk",Percy Jackson and the Olympians,"Percy Jackson and the Olympians Boxed Set (Percy Jackson and the Olympians, #1-5)",
4912,Lisa Gardner,Catch Me,"Catch Me (Detective D.D. Warren, #6)",eng
4913,Debbie Macomber,The Shop on Blossom Street,"The Shop on Blossom Street (Blossom Street, #1)",eng
4914,R.A. Salvatore,Starless Night (Legacy of the Drow #2),"Starless Night (Forgotten Realms: Legacy of the Drow, #2; Legend of Drizzt, #8)",en-GB
4915,Nelson DeMille,Night Fall,"Night Fall (John Corey, #3)",eng
4916,Darren Shan,"Trials of Death (Cirque du Freak, #5) ","Trials of Death (Cirque Du Freak, #5)",
4917,"Eric Van Lustbader, Robert Ludlum",Robert Ludlum's The Bourne Objective,"The Bourne Objective (Jason Bourne, #8)",eng
4918,Elle Kennedy,The Score,"The Score (Off-Campus, #3)",eng
4919,Karen Kingsbury,Even Now,"Even Now (Lost Love, #1)",en-US
4920,Anita Shreve,Testimony,Testimony,en-US
4921,Ilona Andrews,Magic Rises,"Magic Rises (Kate Daniels, #6)",eng
4922,Ben Aaronovitch,Whispers Under Ground,"Whispers Under Ground (Peter Grant, #3)",eng
4923,"James Patterson, Maxine Paetro",Unlucky 13,"Unlucky 13 (Women’s Murder Club, #13)",eng
4924,Sidney Sheldon,The Best Laid Plans,The Best Laid Plans,eng
4925,Terry Pratchett,Nation,Nation,en-US
4926,Lisa Kleypas,Secrets of a Summer Night,"Secrets of a Summer Night (Wallflowers, #1)",eng
4927,Ted Dekker,Red,"Red: The Heroic Rescue (The Circle, #2)",eng
4928,Louise Penny,A Trick of the Light,"A Trick of the Light (Chief Inspector Armand Gamache, #7)",eng
4929,Jennifer L. Armentrout,White Hot Kiss,"White Hot Kiss (The Dark Elements, #1)",eng
4930,"Jun Mochizuki, 望月淳",Pandora Hearts 1,Pandora Hearts 1巻,jpn
4931,H.P. Lovecraft,At the Mountains of Madness,At the Mountains of Madness and Other Tales of Terror,en-US
4932,Mary Karr,Lit,Lit,eng
4933,Anne McCaffrey,"Dragonsdawn (Pern: Dragonriders of Pern, #6)","Dragonsdawn (Pern, #9)",
4934,Kathryn Erskine,Mockingbird,Mockingbird,eng
4935,أحمد حلمي,28 حرف,28 حرف,ara
4936,Joshua Harris,I Kissed Dating Goodbye: New Attitude Toward Romance and Relationship,I Kissed Dating Goodbye,
4937,Zilpha Keatley Snyder,The Egypt Game,"The Egypt Game (Game, #1)",eng
4938,Kaye Gibbons,Ellen Foster,Ellen Foster,eng
4939,"Franz Kafka, Nahum N. Glatzer, John Updike, Willa Muir, Edwin Muir, Tania Stern, James Stern, Ernst Kaiser, Eithne Wilkins",Sämtliche Erzählungen,The Complete Stories,eng
4940,"Isa Chandra Moskowitz, Terry Hope Romero",Veganomicon: The Ultimate Vegan Cookbook,Veganomicon: The Ultimate Vegan Cookbook,
4941,"Margaret Weis, Tracy Hickman","Test of the Twins (Dragonlance Legends, #3)","Test of the Twins (Dragonlance: Legends, #3)",eng
4942,Flannery O'Connor,Wise Blood,Wise Blood,en-US
4943,Sabahattin Ali,Kürk Mantolu Madonna,Kürk Mantolu Madonna,tur
4944,Terry Brooks,Running with the Demon,"Running with the Demon (Word & Void, #1)",eng
4945,Charles M. Sheldon,In His Steps,In His Steps,
4946,Kresley Cole,Lothaire,Lothaire (Immortals After Dark #12),eng
4947,Mo Willems,Knuffle Bunny Too: A Case of Mistaken Identity,"Knuffle Bunny Too: A Case of Mistaken Identity (Knuffle Bunny, #2)",en-US
4948,David Baldacci,The Whole Truth,"The Whole Truth (A. Shaw, #1)",eng
4949,"Elissa Wall, Lisa Pulitzer","Stolen Innocence: My Story of Growing Up in a Polygamous Sect, Becoming a Teenage Bride, and Breaking Free of Warren Jeffs","Stolen Innocence: My Story of Growing Up in a Polygamous Sect, Becoming a Teenage Bride, and Breaking Free of Warren Jeffs",
4950,Ruta Sepetys,Out of the Easy,Out of the Easy,eng
4951,"Ed Brubaker, Doug Mahnke, Patrick Zircher, Aaron Sowd, Steve Bird",Batman: The Man Who Laughs,Batman: The Man Who Laughs,eng
4952,Erin Hunter,Midnight,"Midnight (Warriors: The New Prophecy, #1)",eng
4953,Ben Horowitz,The Hard Thing about Hard Things: Building A Business When There Are No Easy Answers,The Hard Thing About Hard Things: Building a Business When There Are No Easy Answers,eng
4954,Jessica Sorensen,,"The Fallen Star (Fallen Star, #1)",
4955,Stephen R. Donaldson,The Illearth War,"The Illearth War (The Chronicles of Thomas Covenant the Unbeliever, #2)",
4956,Russell Brand,My Booky Wook,My Booky Wook,en-GB
4957,Nora Roberts,Shadow Spell,"Shadow Spell (The Cousins O'Dwyer Trilogy, #2)",en-US
4958,Simon Garfield,Just My Type: A Book About Fonts,Just My Type: A Book About Fonts,en-US
4959,J.D. Robb,Promises in Death,"Promises in Death (In Death, #28)",eng
4960,Charles Bukowski,"Love Is a Dog from Hell: Poems, 1974-1977",Love Is a Dog from Hell,eng
4961,N.K. Jemisin,The Fifth Season,"The Fifth Season (The Broken Earth, #1)",eng
4962,R.D. Ronald,,The Zombie Room,eng
4963,John Katzenbach,The Analyst,The Analyst,eng
4964,Jasper Fforde,Shades of Grey,Shades of Grey,eng
4965,S.E. Hinton,"That Was Then, This Is Now","That Was Then, This Is Now",en-US
4966,"Trenton Lee Stewart, Del Roy",The Mysterious Benedict Society and the Prisoner's Dilemma,"The Mysterious Benedict Society and the Prisoner's Dilemma (The Mysterious Benedict Society, #3)",
4967,Kevin    Wilson,The Family Fang,The Family Fang,en-US
4968,Chris Gardner,The Pursuit of Happyness,The Pursuit of Happyness,
4969,Karl Ove Knausgård,Min kamp 1,Min kamp 1 (Min kamp #1),nor
4970,Alan Bradley,A Red Herring Without Mustard,"A Red Herring Without Mustard (Flavia de Luce, #3)",eng
4971,Doris Kearns Goodwin,No Ordinary Time: Franklin and Eleanor Roosevelt: The Home Front in World War II,No Ordinary Time: Franklin and Eleanor Roosevelt: The Home Front in World War II,eng
4972,Richard Russo,Straight Man,Straight Man,eng
4973,Walker Percy,The Moviegoer,The Moviegoer,en-CA
4974,"Anton Chekhov, Tom    Murphy",Вишнëвый сад,The Cherry Orchard,eng
4975,Wendy Mass,11 Birthdays,"11 Birthdays (Willow Falls, #1)",eng
4976,"J.R.R. Tolkien, Christopher Tolkien",Unfinished Tales of Númenor and Middle-Earth,Unfinished Tales of Númenor and Middle-Earth,
4977,Ann Brashares,Sisterhood Everlasting,"Sisterhood Everlasting (Sisterhood, #5)",eng
4978,Grant Naylor,Infinity Welcomes Careful Drivers,Infinity Welcomes Careful Drivers (Red Dwarf #1),eng
4979,Christopher Moore,Coyote Blue,Coyote Blue,en-US
4980,"أحلام مستغانمي, Ahlam Mosteghanemi",فوضى الحواس,فوضى الحواس,ara
4981,G.K. Chesterton,Orthodoxy,Orthodoxy,eng
4982,"Jane O'Connor, Robin Preiss Glasser",Fancy Nancy,Fancy Nancy,
4983,Graham Greene,The Heart of the Matter,The Heart of the Matter,eng
4984,Jeff Kinney,The Long Haul ,"The Long Haul (Diary of a Wimpy Kid, #9)",eng
4985,"Patricia C. Wrede, Peter de Sève",,"Talking to Dragons (Enchanted Forest Chronicles, #4)",en-US
4986,"James Patterson, Howard Roughan",Sail,Sail,eng
4987,"Neil Gaiman, Chris Riddell",The Sleeper and the Spindle,The Sleeper and the Spindle,eng
4988,Susan Meissner,,A Fall of Marigolds,
4989,"A.N. Roquelaure, Anne Rice",Beauty's Punishment,"Beauty's Punishment (Sleeping Beauty, #2)",en-US
4990,Dee Henderson,The Negotiator,"The Negotiator (O'Malley, #1)",eng
4991,Ravinder Singh,Can Love Happen Twice?,Can Love Happen Twice?,eng
4992,"Gregory Maguire, Douglas Smith",A Lion Among Men,"A Lion Among Men (The Wicked Years, #3)",en-US
4993,Raymond E. Feist,"Shadow of a Dark Queen (The Serpentwar Saga, #1)","Shadow of a Dark Queen (The Serpentwar Saga, #1)",eng
4994,Tobias Wolff,This Boy's Life: A Memoir,This Boy's Life,eng
4995,Jonathan Maberry,Patient Zero,"Patient Zero (Joe Ledger, #1)",en-US
4996,Willa Cather,Death Comes for the Archbishop,Death Comes for the Archbishop,eng
4997,Patricia Briggs,,"Fair Game (Alpha & Omega, #3)",en-US
4998,Rick Riordan,The Son of Sobek,"The Son of Sobek (Percy Jackson & Kane Chronicles Crossover, #1)",eng
4999,"Molière, Martin Sorrell","Le Tartuffe, ou L’Imposteur",Tartuffe,eng
5000,Larissa Ione,Passion Unleashed,Passion Unleashed (Demonica #3),eng
5001,Kazune Kawahara,高校デビュー 1,"High School Debut, Vol. 01 (High School Debut, #1)",en-GB
5002,أثير عبدالله النشمي,في ديسمبر تنتهي كل الأحلام,في ديسمبر تنتهي كل الأحلام,ara
5003,Mercer Mayer,Just for You,Just for You (Little Critter),eng
5004,James Rollins,Amazonia,Amazonia,eng
5005,David D. Burns, Feeling Good: The New Mood Therapy,Feeling Good: The New Mood Therapy,en-US
5006,Nora Roberts,Blue Smoke,Blue Smoke,eng
5007,Patricia Cornwell,Predator,"Predator (Kay Scarpetta, #14)",en-US
5008,Melody Beattie,Codependent No More: How to Stop Controlling Others and Start Caring for Yourself,Codependent No More: How to Stop Controlling Others and Start Caring for Yourself,
5009,"Ivan Goncharov, Stephen Pearl, Galya Diment",Обломов,Oblomov,eng
5010,Clive Cussler,Inca Gold,"Inca Gold (Dirk Pitt, #12)",eng
5011,Ruth Reichl,Delicious!,Delicious!,eng
5012,"Po Bronson, Ashley Merryman",NurtureShock: New Thinking About Children,NurtureShock: New Thinking About Children,en-US
5013,Nelson DeMille,Wild Fire,"Wild Fire (John Corey, #4)",en-US
5014,Mary Higgins Clark,Two Little Girls in Blue,Two Little Girls in Blue,en-US
5015,"Raymond E. Feist, Janny Wurts",Daughter of the Empire,"Daughter of the Empire (The Empire Trilogy, #1)",eng
5016,Neal Shusterman,Everlost,"Everlost (Skinjacker, #1)",eng
5017,Kresley Cole,Dreams of a Dark Warrior,Dreams of a Dark Warrior (Immortals After Dark #11),en-US
5018,"John Grisham, Richard Thomas","Theodore Boone, Kid Lawyer","Theodore Boone: Kid Lawyer (Theodore Boone, #1)",eng
5019,Chris Ware,Jimmy Corrigan: The Smartest Kid on Earth,"Jimmy Corrigan, the Smartest Kid on Earth",
5020,Richard Peck,A Year Down Yonder,"A Year Down Yonder (A Long Way from Chicago, #2)",eng
5021,Kristen Ashley,Own the Wind,"Own the Wind (Chaos, #1)",eng
5022,Carlos Ruiz Zafón,Marina,Marina,spa
5023,Ann Brashares,,My Name Is Memory,eng
5024,Jeanette Winterson,Written on the Body,Written on the Body,en-US
5025,Colleen Houck,Tiger's Voyage,"Tiger's Voyage (The Tiger Saga, #3)",eng
5026,Dean Koontz,Dean Koontz's Frankenstein: Dead and Alive,"Dead and Alive (Dean Koontz's Frankenstein, #3)",eng
5027,Matt Ridley,Genome: The Autobiography of a Species in 23 Chapters,Genome: the Autobiography of a Species in 23 Chapters,en-US
5028,Sandra Boynton,The Going-To-Bed Book,The Going-To-Bed Book,en-US
5029,Louise Rennison,Knocked out by my nunga-nungas,"Knocked Out by My Nunga-Nungas (Confessions of Georgia Nicolson, #3)",en-US
5030,"Tim LaHaye, Jerry B. Jenkins",The Sacrilege: The Antichrist Takes the Throne,"Desecration (Left Behind, #9)",en-US
5031,Phil Klay,Redeployment,Redeployment,eng
5032,Libba Bray,Going Bovine,Going Bovine,eng
5033,James M. Cain,The Postman Always Rings Twice ,The Postman Always Rings Twice,eng
5034,Carrie Ryan,The Dead-Tossed Waves ,"The Dead-Tossed Waves (The Forest of Hands and Teeth, #2)",en-US
5035,Robert Kurson,Shadow Divers: The True Adventure of Two Americans Who Risked Everything to Solve One of the Last Mysteries of World War II,Shadow Divers,eng
5036,Clare Vanderpool,Moon Over Manifest,Moon Over Manifest,eng
5037,Amitav Ghosh,The Glass Palace,The Glass Palace,eng
5038,"Jessica Anthony, Rodrigo Corral",,Chopsticks,eng
5039,Lisa Scottoline,,Every Fifteen Minutes,en-CA
5040,James Dashner,The Eye of Minds,"The Eye of Minds (The Mortality Doctrine, #1)",eng
5041,Agatha Christie,4.50 From Paddington,"4:50 from Paddington (Miss Marple, #8)",eng
5042,J.D. Robb,Ceremony in Death,"Ceremony in Death (In Death, #5)",eng
5043,"Jo Nesbø, Don Bartlett",Kakerlakkene,"Cockroaches (Harry Hole, #2)",eng
5044,Charlaine Harris,Grave Surprise,"Grave Surprise (Harper Connelly, #2)",en-US
5045,"Isabel Allende, Margaret Sayers Peden",La ciudad de las bestias,"City of the Beasts (Eagle and Jaguar, #1)",eng
5046,"Naguib Mahfouz, نجيب محفوظ",أولاد حارتنا,أولاد حارتنا,ara
5047,China Miéville,The Scar,"The Scar (Bas-Lag, #2)",eng
5048,Meg Cabot,Haunted,"Haunted (The Mediator, #5)",eng
5049,Anne McCaffrey,"Dragondrums (Pern: Harper Hall, #3)","Dragondrums (Harper Hall, #3)",eng
5050,Rachel Simon,The Story of Beautiful Girl,The Story of Beautiful Girl,
5051,Dava Sobel,Galileo's Daughter,"Galileo's Daughter: A Historical Memoir of Science, Faith and Love",en-US
5052,Leon Uris,Mila 18,Mila 18,eng
5053,Allen Say,,Drawing from Memory,eng
5054,Amitav Ghosh,Sea of Poppies,"Sea of Poppies (Ibis Trilogy, #1)",eng
5055,"Isaac Asimov, Robert Silverberg",Nightfall,Nightfall,eng
5056,"Melinda Long, David Shannon",How I Became a Pirate,How I Became a Pirate,eng
5057,Edward Abbey,"The Monkey Wrench Gang (Monkey Wrench Gang, #1)","The Monkey Wrench Gang (Monkey Wrench Gang, #1)",en-US
5058,John Irving,Last Night in Twisted River,Last Night in Twisted River,eng
5059,Rob Bell,Love wins,"Love Wins: A Book About Heaven, Hell, and the Fate of Every Person Who Ever Lived",eng
5060,Rachel Caine,Bite Club,"Bite Club (The Morganville Vampires, #10)",eng
5061,Jeffrey Archer,A Matter of Honor,A Matter of Honor,
5062,Linda Howard,Mr. Perfect,Mr. Perfect,eng
5063,M. Leighton,Up to Me,"Up to Me (The Bad Boys, #2)",eng
5064,Mira Lyn Kelly,Waking Up Married,"Waking Up Married (Waking Up, #1)",en-US
5065,Linwood Barclay,No Time for Goodbye,No Time for Goodbye (No Time For Goodbye #1),eng
5066,Katherine Hannigan,"Ida B. . . and Her Plans to Maximize Fun, Avoid Disaster, and (Possibly) Save the World","Ida B. . . and Her Plans to Maximize Fun, Avoid Disaster, and (Possibly) Save the World",eng
5067,Robin Hobb,The Dragon Keeper,"The Dragon Keeper (Rain Wild Chronicles, #1)",eng
5068,Aldo Leopold,A Sand County Almanac,A Sand County Almanac and Sketches Here and There,
5069,"Eric Knight, Marguerite Kirmse",Lassie Come-Home,Lassie Come-Home,
5070,"T. Colin Campbell, Thomas M. Campbell II","The China Study: The Most Comprehensive Study of Nutrition Ever Conducted and the Startling Implications for Diet, Weight Loss and Long-term Health","The China Study: The Most Comprehensive Study of Nutrition Ever Conducted And the Startling Implications for Diet, Weight Loss, And Long-term Health",en-GB
5071,"Julia Donaldson, Axel Scheffler",The Gruffalo,The Gruffalo,eng
5072,Douglas Adams,The Salmon of Doubt: Hitchhiking the Galaxy One Last Time,"The Salmon of Doubt (Dirk Gently, #3)",eng
5073,Arthur C. Clarke,The City and the Stars,The City and the Stars,eng
5074,"Sui Ishida, 石田 スイ",東京喰種トーキョーグール 1,"Tokyo Ghoul, tome 1 (Tokyo Ghoul, #1)",fre
5075,Cressida Cowell,How to train your dragon,"How to Train Your Dragon (How to Train Your Dragon, #1)",en-US
5076,David Foster Wallace,Brief Interviews with Hideous Men,Brief Interviews with Hideous Men,eng
5077,Mary Higgins Clark,All Around the Town,All Around the Town,
5078,Lauren Conrad,L.A. Candy,"L.A. Candy (L.A. Candy, #1)",en-US
5079,Kiera Cass,The Siren,The Siren,eng
5080,Greg Iles,The Quiet Game,The Quiet Game,eng
5081,Joseph J. Ellis,American Sphinx: The Character of Thomas Jefferson,American Sphinx: The Character of Thomas Jefferson,eng
5082,"Jo Nesbø, Don Bartlett",Hodejegerne,Headhunters,eng
5083,Daniel Silva,The Messenger,"The Messenger (Gabriel Allon, #6)",eng
5084,Paul Bowles,The Sheltering Sky,The Sheltering Sky,eng
5085,Patrick Ness,The Rest of Us Just Live Here,The Rest of Us Just Live Here,eng
5086,Alison Weir,The Lady Elizabeth,The Lady Elizabeth,eng
5087,Lily Koppel,The Astronaut Wives Club,The Astronaut Wives Club,eng
5088,"G.K. Chesterton, Jonathan Lethem",The Man Who Was Thursday - A Nightmare,The Man Who Was Thursday: A Nightmare,eng
5089,"Frank B. Gilbreth Jr., Ernestine Gilbreth Carey",Cheaper by the Dozen,Cheaper by the Dozen,eng
5090,"Douglas Preston, Mario Spezi",The Monster of Florence: A True Story,The Monster of Florence,en-US
5091,Daniel Woodrell,Winter's Bone,Winter's Bone,eng
5092,Laurell K. Hamilton,"Seduced by Moonlighty (Merry Gentry, #3)","Seduced by Moonlight (Merry Gentry, #3)",eng
5093,Bernard Cornwell,Sword Song,"Sword Song (The Saxon Stories, #4)",en-US
5094,Jessica Seinfeld,Deceptively Delicious: Simple Secrets to Get Your Kids Eating Good Food,Deceptively Delicious: Simple Secrets to Get Your Kids Eating Good Food,en-US
5095,Anita Shreve,The Weight of Water,The Weight of Water,eng
5096,Katie Ashley,Music of the Heart,"Music of the Heart (Runaway Train, #1)",eng
5097,Maeve Binchy,The Scarlet Feather,Scarlet Feather,eng
5098,Aleatha Romig,,"Truth (Consequences, #2)",eng
5099,"Terry Pratchett, Paul Kidby",The Last Hero,"The Last Hero (Discworld, #27; Rincewind #7)",eng
5100,Isaac Asimov,Fantastic Voyage,Fantastic Voyage,
5101,Philip Gourevitch,We Wish to Inform You That Tomorrow We Will Be Killed with Our Families,We Wish to Inform You That Tomorrow We Will Be Killed with Our Families,en-US
5102,Jonathan Cahn,,The Harbinger: The Ancient Mystery that Holds the Secret of America's Future,
5103,Daniel Silva,The English Girl,"The English Girl (Gabriel Allon, #13)",eng
5104,Susan Vreeland,Clara and Mr. Tiffany,Clara and Mr. Tiffany,
